{
  "version": "1.0",
  "schema_version": "2025-08-26.v1",
  "generated_from": "devops_skilltree_prompt.md",
  "generated_at": "2025-08-26T00:00:00Z",
  "description": "Seed skill tree for DevOps Engineer paths. Each node includes rank rubrics (1-3), concise validation tasks and example evidence.",
  "evidence_schema": {
    "types": {
      "pipeline_run": { "format": "url", "description": "Link to pipeline/build run" },
      "repo": { "format": "url", "description": "Repository URL" },
      "doc": { "format": "url|file", "description": "Design, policy, or architecture document" },
      "screenshot": { "format": "file|url", "description": "Screenshot image or hosted link" },
      "artifact": { "format": "url", "description": "Artifact or package feed link" },
      "metric": { "format": "number|url", "description": "Numeric metric or dashboard link" }
    },
    "preferred_structure": { "type": "object", "properties": { "type": { "type": "string" }, "format": { "type": "string" }, "value": { "type": "string" } }, "required": ["type","value"] }
  },
  "nodes": {
    "CI.VCS": {
      "title": "Version Control Mastery",
      "path": "CI/CD",
      "validation_context": {
        "provider": "github",
        "github_repo": "${GITHUB_REPOSITORY}"
      },
      "depends_on": [],
      "ranks": {
        "1": {
          "level_name": "Beginner",
          "capabilities": "Initialize repos, commit, basic branching and pull requests with guidance.",
          "validation_tasks": ["Create a repo, perform commits and open a PR"],
          "validation_commands": [
            "git rev-parse --is-inside-work-tree",
            "git log -1 --pretty=format:%H"
          ],
          "expected_results": [
            { "type": "exit_code", "value": 0 },
            { "type": "output_non_empty", "field": "commit_hash" }
          ],
          "evidence_examples": ["repo URL", "PR link", "screenshot of commit history"]
        },
        "2": {
          "level_name": "Advanced",
          "capabilities": "Author and enforce branching strategies, reviews, and CI triggers independently.",
          "validation_tasks": ["Implement branch protection and an automated PR build"],
          "validation_commands": [
            "git ls-remote --heads origin",
            "git config --get remote.origin.url || true",
            "gh api repos/${GITHUB_REPOSITORY:-$(basename -s .git $(git config --get remote.origin.url))}/branches/main/protection --jq . || true",
            "az repos policy list --organization $AZ_DEVOPS_ORG_URL --project $AZ_DEVOPS_PROJECT || true"
          ],
          "expected_results": [
            { "type": "exit_code", "value": 0 },
            { "type": "manual_check", "message": "branch_protection:enabled_or_configured (requires provider API)" }
          ],
          "evidence_examples": ["branch policy screenshot", "pipeline URL for PR validation"]
        },
        "3": {
          "level_name": "Expert",
          "capabilities": "Design GitOps workflows, manage enterprise repos, scale cross-team governance.",
          "validation_tasks": ["Design a GitOps repo layout and justify governance choices"],
          "validation_commands": [
            "git ls-files | grep -E 'kustomization.yaml|kustomization.yml|flux|argocd' || true",
            "test -f kustomization.yaml || test -f kustomization.yml || true"
          ],
          "expected_results": [
            { "type": "contains", "value": "declarative_manifests" },
            { "type": "manual_check", "message": "governance_doc:present" }
          ],
          "evidence_examples": ["architecture doc", "policy configuration samples"]
        }
      }
    },
    "CI.PIPE": {
      "title": "Pipeline Authoring",
      "path": "CI/CD",
      "validation_context": {
        "provider": "azuredevops",
        "az_devops_org": "${AZ_DEVOPS_ORG_URL}",
        "az_devops_project": "${AZ_DEVOPS_PROJECT}",
        "pipeline_name": "<pipeline-name>"
      },
      "depends_on": ["CI.VCS"],
      "ranks": {
        "1": {
          "level_name": "Beginner",
          "capabilities": "Write a simple YAML pipeline and run it manually.",
          "validation_tasks": ["Create a single-stage pipeline that builds and tests a sample app"],
          "validation_commands": [
            "ls -la | grep -E 'azure-pipelines.yml|\\.github/workflows/' || true",
            "gh workflow run --repo ${GITHUB_REPOSITORY} --ref $(git rev-parse --abbrev-ref HEAD) || true",
            "az pipelines run --name <pipeline-name> --org $AZ_DEVOPS_ORG_URL --project $AZ_DEVOPS_PROJECT || true"
          ],
          "expected_results": [
            { "type": "file_exists", "path": "pipeline_yaml" },
            { "type": "manual_check", "message": "pipeline_run_url:provided (capture during pipeline trigger)" }
          ],
          "evidence_examples": ["pipeline YAML file", "pipeline run URL"]
        },
        "2": {
          "level_name": "Advanced",
          "capabilities": "Author multi-stage templates and reuse via templates/includes.",
          "validation_tasks": ["Refactor pipeline into templates and inject parameters"],
          "validation_commands": [
            "# Check for template files (e.g., templates/ or .azure-pipelines/templates)",
            "grep -R \"templates\" -n || true"
          ],
          "expected_results": [
            { "type": "templates_present" },
            { "type": "manual_check", "message": "pipeline_runs:stages_executed (verify pipeline run history)" }
          ],
          "evidence_examples": ["template repo links", "example runs across stages"]
        },
        "3": {
          "level_name": "Expert",
          "capabilities": "Create governed, cross-organization pipeline frameworks and promotion gates.",
          "validation_tasks": ["Publish governance templates and show adoption across projects"],
          "validation_commands": [
            "gh api repos/${GITHUB_REPOSITORY:-$(basename -s .git $(git config --get remote.origin.url))}/contents/.github/templates || true",
            "az artifacts universal show --name governance-templates --organization $AZ_DEVOPS_ORG_URL --project $AZ_DEVOPS_PROJECT || true"
          ],
          "expected_results": [
            { "type": "manual_check", "message": "governance_templates:published (query registry)" },
            { "type": "manual_check", "message": "adoption_metrics:available (external dashboard)" }
          ],
          "evidence_examples": ["governance template registry", "adoption metrics"]
        }
      }
    },
    "CI.ART": {
      "title": "Artifact Management",
      "path": "CI/CD",
      "depends_on": ["CI.PIPE"],
      "ranks": {
        "1": {"level_name":"Beginner","capabilities":"Publish and consume simple packages/feeds.","validation_tasks":["Publish a build artifact to a feed"],"evidence_examples":["feed URL","artifact metadata"]},
        "2": {"level_name":"Advanced","capabilities":"Integrate artifact feeds with pipelines and retention policies.","validation_tasks":["Add feed to pipeline consume step and set retention"],"evidence_examples":["pipeline config","feed policy screenshot"]},
        "3": {"level_name":"Expert","capabilities":"Design enterprise artifact governance and cross-org feeds.","validation_tasks":["Define and implement artifact governance plan"],"evidence_examples":["governance docs","audit logs"]}
      }
    },
    "CI.REL": {
      "title": "Release & Gates",
      "path": "CI/CD",
      "depends_on": ["CI.ART"],
      "ranks": {
        "1": {"level_name":"Beginner","capabilities":"Use manual approvals and simple release steps.","validation_tasks":["Create a release with a manual approval gate"],"evidence_examples":["release run URL","approval screenshot"]},
        "2": {"level_name":"Advanced","capabilities":"Automate gates based on tests/metrics and implement basic rollback.","validation_tasks":["Add automated gates (smoke tests) and a rollback step"],"evidence_examples":["gate config","rollback logs"]},
        "3": {"level_name":"Expert","capabilities":"Implement multi-ring deployments with safe promotion and enterprise controls.","validation_tasks":["Implement a staged multi-ring pipeline with metrics-driven promotion"],"evidence_examples":["deployment dashboard","promotion policy docs"]}
      }
    },

    "CLD.AZR": {
      "title": "Azure Resource Management",
      "path": "Cloud & Infrastructure",
      "depends_on": [],
      "ranks": {
        "1": {"level_name":"Beginner","capabilities":"Deploy basic ARM/Bicep templates and understand resource groups.","validation_tasks":["Deploy a simple ARM/Bicep template to a dev subscription"],"evidence_examples":["template file","deployment output"]},
        "2": {"level_name":"Advanced","capabilities":"Apply RBAC, VNets and managed identities in templates.","validation_tasks":["Create templates with RBAC assignment and VNet resources"],"evidence_examples":["template examples","access control screenshots"]},
        "3": {"level_name":"Expert","capabilities":"Design landing zones, policies and enterprise subscription topology.","validation_tasks":["Deliver a landing zone proposal with policy enforcement"],"evidence_examples":["landing zone docs","policy assignments"]}
      }
    },
    "CLD.IAC": {
      "title": "Infrastructure as Code",
      "path": "Cloud & Infrastructure",
      "depends_on": ["CLD.AZR"],
      "ranks": {
        "1": {"level_name":"Beginner","capabilities":"Author simple IaC using ARM/Terraform/Bicep for single resources.","validation_tasks":["Create and apply a basic Terraform/Bicep module"],"evidence_examples":["module repo","apply logs"]},
        "2": {"level_name":"Advanced","capabilities":"Structure reusable modules, handle state, and CI integration.","validation_tasks":["Publish a reusable module and consume it from pipeline"],"evidence_examples":["module registry link","pipeline consuming module"]},